Drug name	Drug number	Line number	Advice Text	AdviceTag1	AdviceTag2	AdviceTag3	AdviceTag4	Medication	Food	Activity	Exercise	DiseaseDesyrel	38	89	"Taking MAO inhibitors with this medication may cause a serious (possibly fatal) drug interaction. Avoid taking MAO inhibitors (isocarboxazid, linezolid, methylene blue, moclobemide, phenelzine, procarbazine, rasagiline, selegiline, tranylcypromine) during treatment with this medication. Most MAO inhibitors should also not be taken for two weeks before and after treatment with this medication."	Other drugs related	Drug administration related	Temporal		MAO inhibitors ;isocarboxazid; linezolid; methylene blue; moclobemide; phenelzine; procarbazine; rasagiline; selegiline; tranylcypromine;				Desyrel	38	99	"Tell your doctor or pharmacist if you are taking other products that cause drowsiness including alcohol, antihistamines (such as cetirizine, diphenhydramine), drugs for sleep or anxiety (such as alprazolam, diazepam, zolpidem), muscle relaxants, and narcotic pain relievers (such as codeine)."	Other drugs related				antihistamines ; cetirizine; diphenhydramine; drugs for sleep or anxiety ; alprazolam; diazepam; zolpidem; muscle relaxants; narcotic pain relievers ; codeine;				Digoxin	39	15	"HOW TO USE:  Take this medication by mouth with or without food, usually once daily or as directed by your doctor."	Food or beverage related	Drug administration related	Temporal						Digoxin	39	18	"Your body may not absorb this drug as well if you also eat foods that are high in fiber or if you take certain medications. Therefore, take this medication at least 2 hours before or after eating food products that are high in fiber (such as bran)."	Food or beverage related	Temporal	Drug administration related			high-fiber foods; bran			Digoxin	39	20	"If you are also taking cholestyramine, colestipol, or psyllium, wait at least 2 hours after taking your digoxin dose before taking any of these products."	Other drugs related	Temporal	Drug administration related						Digoxin	39	21	"If you are taking antacids, kaolin-pectin, milk of magnesia, metoclopramide, sulfasalazine, or aminosalicylic acid, take them as far apart from your digoxin dose as possible."	Other drugs related	Temporal	Drug administration related						Digoxin	39	25	"To help you remember, use it at the same time each day."	Drug administration related	Temporal							Digoxin	39	52	"Do not drive, use machinery, or do any activity that requires alertness or clear vision until you are sure you can perform such activities safely."	Activity or lifestyle related						driving; using machinery; activities requiring alertness		Digoxin	39	53	"The balance of certain natural minerals in your blood (calcium, magnesium, potassium) can affect how this drug works in your body."	Other drugs related								Digoxin	39	54	"Certain drugs such as ""water pills"" (diuretics) may affect the normal balance of these minerals. Tell your doctor or pharmacist if you are taking a ""water pill"" or if you have a history of mineral imbalance."	Other drugs related	Drug administration related			diuretics/water pills				Digoxin	39	56	Ask your doctor or pharmacist whether you should take a nutritional supplement or follow a special diet.	Other drugs related								Digoxin	39	59	"During pregnancy, this medication should be used only when clearly needed."	Pregnancy related								Digoxin	39	61	"Digoxin passes into breast milk. While there have been no reports of harm to nursing infants, consult your doctor before breast-feeding."	Pregnancy related								Digoxin	39	71	"Some products have ingredients that could worsen your heart failure. Tell your pharmacist what products you are using, and ask how to use them safely (especially cough-and-cold products, diet aids, or NSAIDs such as ibuprofen/naproxen)."	Other drugs related				cough-and-cold products; diet aids;NSAIDs; ibuprofen/naproxen				Diovan	40	9	It is important to prevent pregnancy while taking this medication. Consult your doctor for more details and to discuss the use of reliable forms of birth control while taking this medication.	Pregnancy related								Diovan	40	11	"If you are planning pregnancy, become pregnant, or think you may be pregnant, contact your doctor right away."	Pregnancy related								Diovan	40	23	"Take this medication by mouth with or without food as directed by your doctor, usually once or twice daily."	Food or beverage related	Drug administration related	Temporal						Diovan	40	30	"To help you remember, take it at the same time(s) each day."	Drug administration related	Temporal							Diovan	40	36	"To reduce the risk of dizziness and lightheadedness, get up slowly when rising from a sitting or lying position."	Activity or lifestyle related								Diovan	40	60	Limit alcoholic beverages.	Food or beverage related					alcohol			Diovan	40	61	"This medication may increase your potassium levels. Before using potassium supplements or salt substitutes that contain potassium, consult your doctor or pharmacist."	Other drugs related								Diovan	40	64	This medication is not recommended for use during pregnancy. It may harm an unborn baby.	Pregnancy related								Diovan	40	69	It is unknown if this drug passes into breast milk. Consult your doctor before breast-feeding.	Pregnancy related								Diovan	40	76	"Some products that may interact with this drug include: aliskiren, lithium, drugs that may increase the level of potassium in the blood (such as ACE inhibitors including benazepril/lisinopril, birth control pills containing drospirenone)."	Other drugs related								Diovan	40	77	"Some products have ingredients that could raise your blood pressure or worsen your heart failure. Tell your pharmacist what products you are using, and ask how to use them safely (especially cough-and-cold products, diet aids, or NSAIDs such as ibuprofen/naproxen)."	Other drugs related				cough-and-cold products; diet aids;NSAIDs; ibuprofen; naproxen				Diovan	40	85	"Lifestyle changes that may help this medication work better include exercising, stopping smoking, and eating a low-cholesterol/low-fat diet."	Activity or lifestyle related	Exercise related	Food or beverage related			low-cholesterol; low-fat diet	smoking; exercise; 	exercise	Effexor-XR	42	24	"Take this medication by mouth as directed by your doctor, usually once daily with food, either in the morning or evening."	Food or beverage related	Temporal	Drug administration related						Effexor-XR	42	32	Drink a glass of water after each dose.	Food or beverage related		Drug administration related			water			Effexor-XR	42	37	"To help you remember, take it at the same time each day."	Drug administration related	Temporal							Effexor-XR	42	55	"This medication may increase serotonin and rarely cause a very serious condition called serotonin syndrome/toxicity. The risk increases if you are also taking other drugs that increase serotonin, so tell your doctor or pharmacist of all the drugs you take (see Drug Interactions section)."	Other drugs related								Effexor-XR	42	74	"Do not drive, use machinery, or do any activity that requires alertness or clear vision until you are sure you can perform such activities safely."	Activity or lifestyle related						driving; using machinery; activities requiring alertness or clear vision		Effexor-XR	42	75	Avoid alcoholic beverages.	Food or beverage related					alcohol			Effexor-XR	42	78	"Older adults may also be more likely to develop a type of salt imbalance (hyponatremia), especially if they are taking ""water pills"" (diuretics)."	Disease or symptom related	Other drugs related			diuretics; water pills				Effexor-XR	42	82	"During pregnancy, this medication should be used only when clearly needed. It may harm an unborn baby. Also, babies born to mothers who have used this drug during the last 3 months of pregnancy may rarely develop withdrawal symptoms such as feeding/breathing difficulties, seizures, muscle stiffness, or constant crying. If you notice any of these symptoms in your newborn, tell the doctor promptly."	Pregnancy related	Disease or symptom related							Effexor-XR	42	94	"Some products that may interact with this drug include: other drugs that can cause bleeding/bruising (including antiplatelet drugs such as clopidogrel, NSAIDs such as ibuprofen, ""blood thinners"" such as warfarin). Taking MAO inhibitors with this medication may cause a serious (possibly fatal) drug interaction. Avoid taking MAO inhibitors (isocarboxazid, linezolid, methylene blue, moclobemide, phenelzine, procarbazine, rasagiline, selegiline, tranylcypromine) during treatment with this medication. Most MAO inhibitors should also not be taken for two weeks before and at least 7 days after treatment with this medication."	Other drugs related	Drug administration related	Temporal		antiplatelet drugs; clopidogrel; NSAIDs; ibuprofen; blood thinners; warfarin; MAO inhibitors ;isocarboxazid; linezolid; methylene blue; moclobemide; phenelzine; procarbazine; rasagiline; selegiline; tranylcypromine;				Effexor-XR	42	99	"The risk of serotonin syndrome/toxicity increases if you are also taking other drugs that increase serotonin. Examples include street drugs such as MDMA/""ecstasy,"" St. John's wort, certain antidepressants (including SSRIs such as fluoxetine/paroxetine, other SNRIs such as desvenlafaxine/duloxetine), tryptophan, among others. The risk of serotonin syndrome/toxicity may be more likely when you start or increase the dose of these drugs."	Other drugs related				MDMA/ecstasy; St. John's wort; antidepressants ;SSRIs; fluoxetine; paroxetine; SNRIs;  desvenlafaxine ; duloxetine; tryptophan				Effexor-XR	42	103	"Tell your doctor or pharmacist if you are taking other products that cause drowsiness including alcohol, antihistamines (such as cetirizine, diphenhydramine), drugs for sleep or anxiety (such as alprazolam, diazepam, zolpidem), muscle relaxants, and narcotic pain relievers (such as codeine)."	Other drugs related				antihistamines ; cetirizine; diphenhydramine; drugs for sleep or anxiety ; alprazolam; diazepam; zolpidem; muscle relaxants; narcotic pain relievers ; codeine;				Effexor-XR	42	106	Aspirin can increase the risk of bleeding when used with this medication.	Other drugs related	Disease or symptom related			aspirin				Esomeprazole	44	15	"Take this medication by mouth as directed by your doctor, usually once daily, at least 1 hour before a meal."	Food or beverage related	Temporal							Esomeprazole	44	46	Do not use anti-diarrhea products or narcotic pain medications if you have any of the following symptoms because these products may make them worse.	Other drugs related				anti-diarrhea products ; narcotic pain medications				Esomeprazole	44	74	"It is unknown if this medication passes into breast milk. However, similar drugs pass into breast milk. The effects on a nursing infant are unknown. Consult your doctor before breast-feeding."	Pregnancy related								Esomeprazole	44	83	"Some products that may interact with this drug include: cilostazol, clopidogrel, methotrexate (especially high-dose treatment), rifampin, St John's wort."	Other drugs related				cilostazol; clopidogrel; methotrexate ; rifampin; St John's wort; 				Esomeprazole	44	88	Do not use any medications containing omeprazole while using esomeprazole.	Other drugs related				omeprazole				Feldene	45	20	"If you are treating a chronic condition such as arthritis, ask your doctor about non-drug treatments and/or using other medications to treat your pain."	Other drugs related	Disease or symptom related							arthritisFeldene	45	28	Do not lie down for at least 10 minutes after taking this drug.	Activity or lifestyle related	Drug administration related	Temporal				lying down		Feldene	45	29	"To prevent stomach upset, take this medication with food, milk, or an antacid."	Food or beverage related	Drug administration related	Other drugs related		antacid	food;milk			Feldene	45	64	Drink plenty of fluids as directed by your doctor to prevent dehydration and tell your doctor right away if you have a change in the amount of urine.	Food or beverage related					fluids;water			Feldene	45	65	"This drug may make you dizzy or drowsy. Do not drive, use machinery, or do any activity that requires alertness until you are sure you can perform such activities safely."	Activity or lifestyle related					driving; using machinery; activities requiring alertness			Feldene	45	71	"This medication may make you more sensitive to the sun. Avoid prolonged sun exposure, tanning booths or sunlamps. Use a sunscreen and wear protective clothing when outdoors."	Activity or lifestyle related					tanning booths; sunlamps; staying outdoor for long			Feldene	45	77	Tell your doctor if you are pregnant or if you plan to become pregnant.	Pregnancy related								Feldene	45	78	"During pregnancy, this medication should be used only when clearly needed. It is not recommended for use during the first and last trimesters of pregnancy due to possible harm to the unborn baby and interference with normal labor/delivery."	Pregnancy related								Feldene	45	80	This medication passes into breast milk. Consult your doctor before breast-feeding.	Pregnancy related								Feldene	45	86	"Products that may interact with this drug include: aliskiren, ACE inhibitors (such as captopril, lisinopril), angiotensin II receptor blockers (such as losartan, valsartan), cidofovir, corticosteroids (such as prednisone), lithium, ""water pills"" (diuretics such as furosemide)."	Other drugs related				aliskiren; ACE inhibitors ; captopril; lisinopril; angiotensin II receptor blockers ; losartan; valsartan;; cidofovir; corticosteroids ; prednisone; lithium; water pills ;diuretics;  furosemide;				Feldene	45	89	"Check all prescription and nonprescription medicine labels carefully since many medications contain pain relievers/fever reducers (aspirin, NSAIDs such as celecoxib, ibuprofen, or ketorolac). These drugs are similar to piroxicam and may increase your risk of side effects if taken together."	Other drugs related				aspirin; NSAIDs; celecoxib; ibuprofen; ketorolac;				Feldene	45	101	"Lifestyle changes (such as weight loss if needed, strengthening/conditioning exercises) may help improve your flexibility and joint function."	Activity or lifestyle related	Exercise related					losing weight; strengthening exercise; conditioning exercises; 	strengthening exercise; conditioning exercises; 	Fentanyl	46	25	"Before using this medication, women of childbearing age should talk with their doctor(s) about the risks and benefits."	Pregnancy related								Fentanyl	46	26	Tell your doctor if you are pregnant or if you plan to become pregnant.	Pregnancy related								Fentanyl	46	28	"It may slightly increase the risk of birth defects if used during the first two months of pregnancy. Also, using it for a long time or in high doses near the expected delivery date may harm the unborn baby."	Pregnancy related								Fentanyl	46	30	"To lessen the risk, take the smallest effective dose for the shortest possible time."	Pregnancy related								Fentanyl	46	31	"Babies born to mothers who use this drug for a long time may develop severe (possibly fatal) withdrawal symptoms. Tell the doctor right away if you notice any symptoms in your newborn baby such as slow/shallow breathing, irritability, shaking, persistent crying, vomiting, diarrhea, poor feeding, or difficulty gaining weight."	Pregnancy related								Fentanyl	46	53	"Select a dry, non-hairy area on a flat part of your body, such as the chest, sides, back, or upper arms."	Drug administration related								Fentanyl	46	54	"In young children or in people unable to think clearly (such as due to dementia), apply the patch on the upper back to lessen the chance it might be removed or placed in the mouth."	Drug administration related								Fentanyl	46	55	"If there is hair on the skin, use scissors to clip the hair as close as possible to the skin. Do not shave hair since this might cause skin irritation. If needed, use water to clean the area. Do not use soap, oils, lotions, or alcohol on the application site. Dry the skin well before applying the patch."	Activity or lifestyle related	Drug administration related					shaving		Fentanyl	46	63	"The used patch still contains enough fentanyl to cause serious harm, even kill a child or pet, so fold it in half with the sticky sides together and discard properly."									Fentanyl	46	64	"Do not let children see you apply a patch, and do not apply the patch where children can see it. Children have found patches that have fallen off or removed patches on sleeping adults and put them in their mouths or on their bodies with fatal results."	Activity or lifestyle related	Drug administration related							Fentanyl	46	71	Wash your hands after applying the patch.	Activity or lifestyle related	Drug administration related							Fentanyl	46	77	"If the patch comes off and accidentally sticks to the skin of another person, immediately remove the patch, wash the area with water, and get medical help for them right away. Do not use soap, alcohol, or other products to wash the area."	Activity or lifestyle related	Drug administration related							Fentanyl	46	87	"Along with its benefits, this medication may rarely cause abnormal drug-seeking behavior (addiction). This risk may be increased if you have abused alcohol or drugs in the past."	Disease or symptom related	Food or beverage related				alcohol			addictionFentanyl	46	95	"To prevent constipation, eat a diet adequate in fiber, drink plenty of water, and exercise."	Food or beverage related	Disease or symptom related	Exercise related			high-fiber diet; water			constipationFentanyl	46	97	"To reduce the risk of dizziness and lightheadedness, get up slowly when rising from a sitting or lying position."	Activity or lifestyle related						getting up		Fentanyl	46	100	"Tell your doctor right away if any of these unlikely but serious side effects occur: mental/mood changes (such as agitation, confusion, hallucinations), severe stomach/abdominal pain, difficulty urinating, slow/fast/pounding heartbeat, signs of your adrenal glands not working well (such as loss of appetite, unusual tiredness, weight loss)."	Disease or symptom related								Fentanyl	46	102	This medication may increase serotonin and rarely cause a very serious condition called serotonin syndrome/toxicity.	Disease or symptom related								serotonin syndrome/toxicityFentanyl	46	103	"The risk increases if you are also taking other drugs that increase serotonin, so tell your doctor or pharmacist of all the drugs you take (see Drug Interactions section). Get medical help right away if you develop some of the following symptoms: fast heartbeat, hallucinations, loss of coordination, severe dizziness, severe nausea/vomiting/diarrhea, twitching muscles, unexplained fever, unusual agitation/restlessness."	Disease or symptom related	Other drugs related							Fentanyl	46	122	Avoid alcoholic beverages.	Food or beverage related					alcohol			Fentanyl	46	124	Avoid activities that might cause your body temperature to rise. (such as doing strenuous work/exercise in hot weather).	Activity or lifestyle related	Exercise related					hard work; hard exercise; 	hard exercise	Fentanyl	46	127	"If you are going to have an MRI test, tell testing personnel that you are using this patch. Some patches may contain metals that can cause serious burns during an MRI."									Fentanyl	46	129	"Ask your doctor whether you will need to remove your patch before the test and apply a new patch afterward, and how to do so properly."									Fentanyl	46	131	"During pregnancy, this medication should be used only when clearly needed. It may harm an unborn baby."	Pregnancy related								Fentanyl	46	136	"This drug passes into breast milk and may rarely have undesirable effects on a nursing infant. Tell the doctor right away if your baby develops unusual sleepiness, difficulty feeding, or trouble breathing."	Pregnancy related								Fentanyl	46	143	"Some products that may interact with this drug include: certain pain medications (mixed opioid agonist-antagonists such as pentazocine, nalbuphine, butorphanol), opioid antagonists (such as naltrexone)."	Other drugs related				pain medications ;mixed opioid agonist-antagonists;  pentazocine; nalbuphine; butorphanol; opioid antagonists ; naltrexone;				Fentanyl	46	144	"Other medications can affect the removal of fentanyl from your body, which may affect how fentanyl works. Examples include cimetidine, nefazodone, azole antifungals including itraconazole/ketoconazole, calcium channel blockers such as diltiazem/verapamil, HIV drugs such as nelfinavir/ritonavir, macrolide antibiotics including clarithromycin/erythromycin, rifamycins including rifampin, certain anti-seizure medicines including carbamazepine, among others."	Other drugs related				cimetidine; nefazodone; azole antifungals; itraconazole; ketoconazole; calcium channel blockers  diltiazem; verapamil; HIV drugs;  nelfinavir; ritonavir; macrolide antibiotics; clarithromycin; erythromycin; rifamycins;  rifampin; anti-seizure medicines; carbamazepine;				Fentanyl	46	146	"Taking MAO inhibitors with this medication may cause a serious (possibly fatal) drug interaction. Avoid taking MAO inhibitors (isocarboxazid, linezolid, methylene blue, moclobemide, phenelzine, procarbazine, rasagiline, selegiline, tranylcypromine) during treatment with this medication. Most MAO inhibitors should also not be taken for two weeks before treatment with this medication."	Other drugs related	Drug administration related	Temporal		MAO inhibitors ;isocarboxazid; linezolid; methylene blue; moclobemide; phenelzine; procarbazine; rasagiline; selegiline; tranylcypromine;				Fentanyl	46	153	"The risk of serotonin syndrome/toxicity increases if you are also taking other drugs that increase serotonin. Some examples are street drugs such as MDMA/ ""ecstasy,"" St. John's wort, certain antidepressants (such as SSRIs like fluoxetine/paroxetine, SNRIs like duloxetine/venlafaxine), among others."	Other drugs related	Disease or symptom related			MDMA/ ecstas; St. John's wort; antidepressants ; SSRIs; fluoxetine; paroxetine; SNRIs;  duloxetine; venlafaxine;				serotonin syndrome/toxicityFentanyl	46	156	The risk of serotonin syndrome/toxicity may be more likely when you start or increase the dose of these drugs.	Other drugs related	Disease or symptom related							serotonin syndrome/toxicityFlagyl	47	13	Wash your hands before and after use.	Activity or lifestyle related	Drug administration related					washing hands		Flagyl	47	40	"This product may contain inactive ingredients (such as paraben preservatives), which can cause allergic reactions or other problems."	Disease or symptom related								allergyFlagyl	47	45	"Do not drink alcohol while using this medication and for at least 24 hours after treatment. Drinking alcohol while using this medication may cause stomach cramps, flushing, nausea, vomiting, and headache."	Food or beverage related	Temporal	Disease or symptom related			alcohol			Flagyl	47	47	Do not have vaginal sex or use tampons or douches while using this medication.	Activity or lifestyle related	Drug administration related					having sex; using tampons		Flagyl	47	48	"During pregnancy, this medication should be used only when clearly needed."	Pregnancy related								Flagyl	47	51	The medication in this product may pass into breast milk in small amounts. Consult your doctor before breast-feeding.	Pregnancy related								Flagyl	47	58	Do not use this medication if you have taken disulfiram within the last 2 weeks.	Other drugs related	Temporal			disulfiram				Flagyl	47	59	Do not take products containing alcohol or propylene glycol while using this medication and for at least 24 hours after treatment.	Food or beverage related	Temporal				alcohol; propylene glycol; food coloring;  iced tea; ice cream; salad dressing; boxed cake;			Flomax	48	19	"Take this medication by mouth as directed by your doctor, usually once daily, 30 minutes after the same meal each day."	Drug administration related	Temporal	Food or beverage related						Flomax	48	20	Swallow this medication whole.	Drug administration related								Flomax	48	21	"Do not crush, chew, or open the capsules."	Drug administration related								Flomax	48	33	"To reduce the risk of dizziness and lightheadedness, get up slowly when rising from a sitting or lying position."	Activity or lifestyle related						getting up		Flomax	48	54	This drug may make you dizzy or drowsy.	Disease or symptom related								Flomax	48	55	"Do not drive, use machinery, or do any activity that requires alertness until you are sure you can perform such activities safely."	Activity or lifestyle related	Disease or symptom related					driving; using machinery; activities requiring alertness		Flomax	48	56	Limit alcoholic beverages.	Food or beverage related					alcohol			Flomax	48	57	"Before having surgery (including cataract/glaucoma eye surgery), tell your doctor or dentist if you are taking or have ever taken this medication, and about all the other products you use (including prescription drugs, nonprescription drugs, and herbal products)."	Other drugs related								Flomax	48	60	"During pregnancy, this medication should be used only when clearly needed."	Pregnancy related								Flomax	48	62	It is unknown if this medication passes into breast milk. Consult your doctor before breast-feeding.	Pregnancy related								Flomax	48	68	"Some products that may interact with this drug include: other alpha blocker drugs (such as prazosin, terazosin)."	Other drugs related				alpha blocker drugs ; prazosin; terazosin;				